{
  "benchmark": "OPBENCH-lite",
  "entries": [
    {
      "adequate_proposal_notes": [
        "Use this as a measured signal to focus a bounded proposal on the named normalized population and preserve the outcome definition.",
        "Do not claim that the reason or channel caused the outcome; any benefit estimate requires a separate validated scenario."
      ],
      "caveats": [
        "The comparison is against the pooled complement of this metric, not a causal control.",
        "The source flag measures first-call resolution only; the complaint tag is not a root cause.",
        "Synthetic hackathon snapshot; not real-bank prevalence or causal evidence."
      ],
      "cell": {
        "channel": "phone",
        "reason_category": "complaint"
      },
      "cells_explored": {
        "family_size": 181
      },
      "denominator": 99554,
      "discovery": {
        "adjusted_q": 0.0,
        "baseline_denominator": 293216,
        "baseline_numerator": 51837,
        "denominator": 49649,
        "effect": {
          "ci95_high": 0.391304,
          "ci95_low": 0.382152,
          "difference": 0.386728
        },
        "numerator": 27978
      },
      "effect": {
        "ci95_high": 0.391304,
        "ci95_low": 0.382152,
        "difference": 0.386728
      },
      "effect_basis": "discovery cell versus its pooled complement; replicated independently in the second hash split",
      "family": "attention_contact",
      "id": "OPB-01",
      "improvement_tags": [
        "flow",
        "decision_model",
        "agent"
      ],
      "k_min_ok": true,
      "mechanism_class": "observed_outcome_association_hypothesis_only",
      "metric_id": "M1",
      "multiple_testing": {
        "adjusted_q": 0.0,
        "family_size": 181,
        "method": "two_proportion_z_benjamini_hochberg_fdr"
      },
      "numerator": 56129,
      "population": "pre-registered aggregate cell in the synthetic hackathon snapshot",
      "replicated": true,
      "replication": {
        "adjusted_q": 0.0,
        "baseline_denominator": 293526,
        "baseline_numerator": 52300,
        "denominator": 49905,
        "effect": {
          "ci95_high": 0.390479,
          "ci95_low": 0.381348,
          "difference": 0.385913
        },
        "numerator": 28151,
        "p_value": 0.0
      },
      "snapshot": {
        "denominator": 99554,
        "numerator": 56129,
        "rate": 0.563805,
        "suppressed": false,
        "suppression_reason": null
      },
      "status": "corroborated",
      "title": "First-call unresolved rate is higher for phone contacts tagged complaint",
      "type": "problem"
    },
    {
      "adequate_proposal_notes": [
        "Use this as a measured signal to focus a bounded proposal on the named normalized population and preserve the outcome definition.",
        "Do not claim that the reason or channel caused the outcome; any benefit estimate requires a separate validated scenario."
      ],
      "caveats": [
        "The comparison is against the pooled complement of this metric, not a causal control.",
        "The source flag measures first-call resolution only; the complaint tag is not a root cause.",
        "Synthetic hackathon snapshot; not real-bank prevalence or causal evidence."
      ],
      "cell": {
        "channel": "mobile_app",
        "reason_category": "complaint"
      },
      "cells_explored": {
        "family_size": 181
      },
      "denominator": 4399,
      "discovery": {
        "adjusted_q": 0.0,
        "baseline_denominator": 340686,
        "baseline_numerator": 78576,
        "denominator": 2179,
        "effect": {
          "ci95_high": 0.358812,
          "ci95_low": 0.317125,
          "difference": 0.337969
        },
        "numerator": 1239
      },
      "effect": {
        "ci95_high": 0.358812,
        "ci95_low": 0.317125,
        "difference": 0.337969
      },
      "effect_basis": "discovery cell versus its pooled complement; replicated independently in the second hash split",
      "family": "attention_contact",
      "id": "OPB-02",
      "improvement_tags": [
        "flow",
        "decision_model",
        "agent"
      ],
      "k_min_ok": true,
      "mechanism_class": "observed_outcome_association_hypothesis_only",
      "metric_id": "M1",
      "multiple_testing": {
        "adjusted_q": 0.0,
        "family_size": 181,
        "method": "two_proportion_z_benjamini_hochberg_fdr"
      },
      "numerator": 2460,
      "population": "pre-registered aggregate cell in the synthetic hackathon snapshot",
      "replicated": true,
      "replication": {
        "adjusted_q": 0.0,
        "baseline_denominator": 341211,
        "baseline_numerator": 79230,
        "denominator": 2220,
        "effect": {
          "ci95_high": 0.338541,
          "ci95_low": 0.297054,
          "difference": 0.317798
        },
        "numerator": 1221,
        "p_value": 4.9463595627944404e-272
      },
      "snapshot": {
        "denominator": 4399,
        "numerator": 2460,
        "rate": 0.559218,
        "suppressed": false,
        "suppression_reason": null
      },
      "status": "corroborated",
      "title": "First-call unresolved rate is higher for mobile_app contacts tagged complaint",
      "type": "problem"
    },
    {
      "adequate_proposal_notes": [
        "Use this as a measured signal to focus a bounded proposal on the named normalized population and preserve the outcome definition.",
        "Do not claim that the reason or channel caused the outcome; any benefit estimate requires a separate validated scenario."
      ],
      "caveats": [
        "Low CSAT is score 1–2 on a 1–5 scale; this is not NPS.",
        "Survey channel 'other' includes unsupported delivery labels; association does not establish cause.",
        "Synthetic hackathon snapshot; not real-bank prevalence or causal evidence."
      ],
      "cell": {
        "channel": "email",
        "reason_category": "complaint"
      },
      "cells_explored": {
        "family_size": 181
      },
      "denominator": 8607,
      "discovery": {
        "adjusted_q": 0.0,
        "baseline_denominator": 59466,
        "baseline_numerator": 17693,
        "denominator": 4318,
        "effect": {
          "ci95_high": 0.257153,
          "ci95_low": 0.226524,
          "difference": 0.241839
        },
        "numerator": 2329
      },
      "effect": {
        "ci95_high": 0.257153,
        "ci95_low": 0.226524,
        "difference": 0.241839
      },
      "effect_basis": "discovery cell versus its pooled complement; replicated independently in the second hash split",
      "family": "attention_contact",
      "id": "OPB-03",
      "improvement_tags": [
        "flow",
        "decision_model",
        "agent"
      ],
      "k_min_ok": true,
      "mechanism_class": "observed_outcome_association_hypothesis_only",
      "metric_id": "M6",
      "multiple_testing": {
        "adjusted_q": 0.0,
        "family_size": 181,
        "method": "two_proportion_z_benjamini_hochberg_fdr"
      },
      "numerator": 4687,
      "population": "pre-registered aggregate cell in the synthetic hackathon snapshot",
      "replicated": true,
      "replication": {
        "adjusted_q": 0.0,
        "baseline_denominator": 59783,
        "baseline_numerator": 17688,
        "denominator": 4289,
        "effect": {
          "ci95_high": 0.269241,
          "ci95_low": 0.238576,
          "difference": 0.253908
        },
        "numerator": 2358,
        "p_value": 5.786510631532395e-263
      },
      "snapshot": {
        "denominator": 8607,
        "numerator": 4687,
        "rate": 0.544557,
        "suppressed": false,
        "suppression_reason": null
      },
      "status": "corroborated",
      "title": "Low CSAT is more common for linked complaint contacts surveyed via email",
      "type": "problem"
    },
    {
      "adequate_proposal_notes": [
        "Do not prioritize a targeted change for this cell from the current evidence; the registered material-difference rule was not met.",
        "Keep this result as a negative benchmark so future proposals do not overfit noise or turn the category into a cause."
      ],
      "caveats": [
        "This is a repeated opaque query signature, not repeated customer intent or a causal mechanism.",
        "The discovery-to-replication difference is below the preregistered five-percentage-point threshold.",
        "Synthetic hackathon snapshot; not real-bank prevalence or causal evidence."
      ],
      "cell": {
        "scope": "overall"
      },
      "cells_explored": {
        "family_size": 181
      },
      "denominator": 1709,
      "discovery": {
        "adjusted_q": 1.0,
        "baseline_denominator": null,
        "baseline_numerator": null,
        "denominator": 870,
        "effect": {
          "ci95_high": 0.035837,
          "ci95_low": -0.012922,
          "difference": 0.011457
        },
        "numerator": 803
      },
      "effect": {
        "ci95_high": 0.035837,
        "ci95_low": -0.012922,
        "difference": 0.011457
      },
      "effect_basis": "discovery-selected modal signature rate: replication minus discovery",
      "family": "e0_operations",
      "id": "OPB-04",
      "improvement_tags": [],
      "k_min_ok": true,
      "mechanism_class": "observed_outcome_association_hypothesis_only",
      "metric_id": "E1",
      "multiple_testing": {
        "adjusted_q": 1.0,
        "family_size": 181,
        "method": "two_proportion_z_benjamini_hochberg_fdr"
      },
      "numerator": 1587,
      "population": "pre-registered aggregate cell in the synthetic hackathon snapshot",
      "replicated": true,
      "replication": {
        "adjusted_q": 1.0,
        "denominator": 839,
        "effect": {
          "ci95_high": 0.035837,
          "ci95_low": -0.012922,
          "difference": 0.011457
        },
        "numerator": 784,